school_name,school_type,estimated_enrollment,principal,hours,this_school_feeds_into,neighborhood,school_bus,school_meals,school_code,about,before_school_programs,after_school_programs,special_education_programs,school_day_academic_enrichment,arts_enrichment,student_support_programs,address,phone_number,fax_number,website,assistant_principal,school_tour,language_programs,email,other_campuses,uniforms_policy,athletics,transportation
Dr. Charles R. Drew College Preparatory Academy,"Early Education, Elementary School, PreK/TK-5",215,Vidrale Franklin,7:50 am-1:55 pm,Willie L. Brown Jr. Middle SchoolA.P. Giannini Middle School,Bayview,"94124, 94107, 94134","Breakfast, Lunch, After School Supper",507,We offer a PreK program for children 2 years and 9 months to 5 years old. Learn more about our PreK program.,NA,"Program: PreK , TK & K-5, 7:30 a.m.-5:30 p.m., 415-330-1546.",Separate class - Mild/moderate for K-5,Tutoring in school,"Choral music, movement class, poetry, gardening, cooking, art, Aims music program, Spanish/ music program",NA,"50 Pomona Street, San Francisco, CA, 94124",415-330-1526,415-822-9210,NA,De Trice Rogers,Call school for times and dates.,NA,NA,NA,"Girls: Black skirt, jumper or pants, white collared shirt/polo/peter pan collar, burgundy sweater or vest, all-black shoes",NA,NA
Dr. George Washington Carver Elementary School,"Elementary School, K-5",170,Emmanuel Stewart,8:30 am-2:40 pm,Willie L. Brown Jr. Middle SchoolAptos Middle School,Bayview,NA,"Breakfast, Lunch, After School Supper",625,"Carver offers students a variety of enrichment opportunities, including an after-school program. Teachers working in the after-school program provide 1:1 tutoring and cooperative lessons, as well as implement programs such as “X - KIDZ” (a hands on science program) and Street Side Stories (a creative arts program). Other programs for parents include parent leadership classes, Family Math Night and Family Literacy Night. Historically, Carver has been an award-winning school, and we strive to maintain the excellence of ourselves and our achievers. Most recently, Principal Emmanuel Stewart was awarded San Francisco’s Mayor’s 2017-2018 Elementary Principal of the Year!",NA,"Carver’s after-school program is in partnership with the Boys & Girls Clubs of San Francisco. It’s a Beacon Program that provides enrichment activities, physical fitness activities, tutoring and homework support, family engagement, vision screening and dental screening. The focus is to help Carver students develop the values, skills, attitudes, character and behavior that will enable them to succeed in life.",Resource Specialist services,Tutoring in school,For grade 4-5,Therapist,"1360 Oakdale Avenue, San Francisco, CA, 94124",415-330-1540,415-467-7217,NA,Makaela Manning,Friday mornings. Morning visits by appointment.,NA,NA,NA,"Girls: navy blue pants ONLY, white blouse, Mayfair plaid jumper, Mayfair sweater.",NA,NA
Dr. William L. Cobb Elementary School,"Early Education, Elementary School, PreK-5",180,Joseph Funk,Each Thursday our students are released early so that teachers and staff can participate in regular Professional Development and Planning.,Roosevelt Middle School,"Lower Pacific Heights, Western Addition",NA,"Breakfast, Lunch",525,What do Cobb Tigers do? We ROAR with excellence!,NA,Afterschool programming provided by the Beacon / Buchanan YMCA from end of school day to 6 p.m. every day.  The Beacon offers a balance of academic support and enrichment activities for approximately 60 students each day.,"Cobb also provides Speech and Language, Occupational Therapy and Physical Therapy to students with IEPs as appropriate.",Tutoring in school,"Students at Cobb are exposed to a variety of visual and performing arts, including drawing, painting, dancing, music, and drama.  Students enjoy Playworks to promote fun and safe play during recess.",Therapist,"2725 California Street, San Francisco, CA, 94115",415-749-3505,415-749-3436,NA,NA,She will be able to make individual arrangements with interested families.,NA,sch525@sfusd.edu,NA,"Uniforms are not required, but are encouraged.",NA,NA
E.R. Taylor Elementary School,"Early Education, Elementary School, PreK-5",660,Angienette Estonina,8:40 am-2:45 pm,"Dr. Martin Luther King, Jr. Middle School",Excelsior,94134,"Breakfast, Lunch",513,"E.R. Taylor seeks to promote intellectual development, physical and mental health, self-discipline and cultural sensitivity so that each student can achieve their fullest potential and be college-bound. E.R. Taylor is a unique school located in a quiet neighborhood in the southeast section of San Francisco with a variety of programs to support student achievement. The school consists of Pre-K-5th grade classes with English Learner Development, Spanish Bilingual, and Chinese Bilingual classrooms available. In addition there is a Healthy Start program that provides family support services to help our parents/guardians support their children to reach their potential. We seek to communicate clearly and frequently with parents through our Parent Workshop Classes and Monthly Principal Newsletters and Coffee. Through the Second Step program, and the Positive Interventions Behavior Support (PBIS) framework, we stress positive peer relationships among students and maintain high expectations for student behavior school-wide. Our students have opportunities to participate as leaders through community service projects. We provide opportunities for student choice in learning to encourage children to discover their own talents and strengths through class projects, or performances, such as gardening activities, hands-on science experiments, and visual and performing arts. Our children benefit from a variety of extended learning opportunities, such as our Artist-in-Residence, Playworks, and the Green Garden program. Many students enjoy music through the Taylor Student Chorus and instrumental music lessons offered to 4th and 5th grade students. The enriching After School Program provides fun-filled lessons, including sports, music, cooking and art.",NA,"ExCEL program offered at no cost to family, from end of school until 5:45 PM (grades 1-5). 12 sessions Scores Soccer (grades 3-5). Community based programs enroll and accompany students to after school locations.",Separate class - Mild/moderate with autism focus for grades K-5,Technology teacher,Visual artists work with grades K-5; artist residency programs,Family liaison,"423 Burrows Street, San Francisco, CA, 94134",415-330-1530,415-468-1742,NA,Ana Zambrano,First Monday of month at 9:00 a.m.,Spanish Biliteracy Program,zambranoa@sfusd.edu,NA,"White shirt/blouse with a collar, black pants, jumpers/skirts. Maroon sweaters and sweatshirts are available to order.",NA,NA
Edwin and Anita Lee Newcomer School,"Elementary School, K-5",100,Victor Tam,8:30 am-2:35 pm,Francisco Middle SchoolVisitacion Valley Middle School,"Chinatown, Financial District",NA,"Breakfast, Lunch, After School Supper",476,"Fifth-graders feed into Francisco Middle School OR Visitacion Valley Middle School. As a one-year newcomer program, the K-4 students have the opportunity to transfer to any SFUSD elementary school. Generally, grades K-1-2-3-4 newcomer students who enroll after JANUARY 1st are eligible to remain here for another school year.",NA,"2:35 - 6:00 p.m. The ExCEL Afterschool Program is run by the Chinatown YMCA.  It is on-site and provides tutorial, enrichment, and recreational activities for students to extend their opportunity to learn and use English.  The program is fee based but is subsidized for students who qualify.",Resource Specialist services,Technology teacher,"All students participate in visual and performing arts classes that are focused on drama, music and the visual arts.  In addition, we have the District Instrumental Program available to students in grades 3-5.",Family liaison,"657 Merchant Street, San Francisco, CA, 94111",415-291-7918,415-291-7965,NA,NA,Please call for an appointment.,Chinese Newcomer Program,sch476@sfusd.edu,NA,NA,NA,NA
El Dorado Elementary School,"Elementary School, K-5",180,Sylvia Cordero,7:50 am-1:50 pm,Visitacion Valley Middle School,Visitacion Valley,"94124, 94134","Breakfast, Lunch",521,"We offer students extended learning opportunities that allow them to explore areas of learning beyond traditional academics. These programs include expanded visual and performing arts experiences with professional artists and musicians, as well as science and outdoor education partnerships with Kids in Parks and Excelsior Science Center. We also host monthly events that incorporate school-wide programs, such as Harvest of the Month, Cultural Assemblies, Literacy Night and Math Night.",NA,Real Options for City Kids (ROCK) M-F 1:50 to 6:00 p.m.,Separate class - Social-emotional/behavioral enhanced classroom (SOAR) for grades 3-5,Tutoring in school,"Music Instruction for K-5 once a week, 3-4 grade ballet residency, K-3 visual art residencies, afterschool program music/art programs (The Nature of Music and others), 4-5 art teachers (once a week), drama K-3",Family liaison,"70 Delta Street, San Francisco, CA, 94134",415-330-1537,415-467-2435,http://www.eldoradoelementarysf.com,Charles Glover,Tuesday mornings 8-10 a.m. or by appointment. Spanish and English tours available.,NA,sch521@sfusd.edu,NA,NA,NA,NA
Francis Scott Key Elementary School,"Elementary School, K-5",575,Mimi Ying Kasner,7:50 am-1:50 pm,A.P. Giannini Middle School,Outer Sunset,NA,"Breakfast, Lunch, After School Supper",544,"Our School Design Challenge: We believe in designing a learning environment that will enable teachers to develop and implement authentic inquiry based learning by optimizing existing classroom space and ensuring access for ALL students specifically ELL, SPED, and Girls as we build an integrated program focusing on S.T.E.A.M. education.",NA,"FSK after school program serves 400 students each day from 1:50 pm to 6:00 pm. As the extended day program, afterschool staff provide academic supports, homework help, and many extracurricular programs and activities including Mandarin, Spanish, Science, STEM, Art and more. These programs embrace the FSK school mission and vision. They follow the same expectations as defined by FSK community.",Separate class - Moderate/severe for grades 4-5,Tutoring in school,"Academic Chess, Visual Art Dance Camp, Movement Studio Art Ribbon Dance, Art in Action, Guitar and other Instrumental Music",Family liaison,"1530 43rd Avenue, San Francisco, CA, 94122",415-759-2811,415-759-2810,http://www.francisscottkeyschool.org/,Catherine HornMegan Page,"Wednesdays from 8:30 - 9:30 am, Oct. 17, 2018 - Jan.16, 2019. Call office @ (415) 759-2811 to schedule Individual Tours.",NA,kasnery@sfusd.edu,NA,NA,NA,NA
Frank McCoppin Elementary School,"Early Education, Elementary School, PreK-5",225,Bennett Lee,Kindergarten: 8:40am-2:30pm,Roosevelt Middle School,Inner Richmond,NA,"Breakfast, Lunch, After School Supper",549,"We believe that increasing communication and involvement with students' families will help us succeed in our promises to our students and their families. McCoppin School has been completely renovated and remodeled. We have brand new classrooms as well as a brand new multipurpose area with attached offices and a brand new library. The playground will be resurfaced and expanded. Plans are in place to implement new outdoor classrooms, a community mural on 6th Ave. and other greening projects for the school. We invite you to come take a look and be impressed!",Please accompany your child to the classroom to sign them in.,Email: argishti@rdnc.org,Resource Specialist services,Technology or computer lab,Dance and Movement,Family liaison,"651 6th Avenue, San Francisco, CA, 94118",415-750-8475,415-750-8474,NA,NA,Thursdays at 9 a.m. Please call to schedule a visit. Check in at the main office.,NA,sch549@sfusd.edu,NA,NA,NA,NA
Garfield Elementary School,"Elementary School, K-5",225,Jennifer Sethasang,7:50 am-1:50 pm,Francisco Middle School,North Beach,NA,"Breakfast, Lunch",562,"Our teachers make learning fun through the use of games, songs, and special projects. School-wide events, such as holiday and multicultural performances, and assemblies that recognize student achievement, create a strong community that builds students' confidence. We believe in strong, frequent, and meaningful communication with families. Avenues of communication include weekly bulletins, classroom newsletters, and weekly Student Success Team meetings to help parents develop strategies for improving attendance and academic achievement.",NA,"Garfield afterschool program: 1:50 to 6:00 p.m., grades K to 5. Scholarship and sliding-scale fee-based. Includes homework support, snacks, and enrichment activities/sports/clubs.",Separate class - Mild/moderate with autism focus,Tutoring in school,"Community-based organization: Leap... Imagination in Learning once to twice weekly, visual arts teacher bi-weekly, SF Symphony",Social worker,"940 Filbert Street, San Francisco, CA, 94133",415-291-7924,415-291-7916,http://www.garfieldelementarysf.org/,NA,Wednesdays at 8:45 a.m. by appointment only. First Wednesday of the Month is reserved for Special Day Class tours. Please call at least 24 hours in advanced to schedule.,Cantonese Dual Language Immersion,sch562@sfusd.edu,NA,NA,NA,NA
George Peabody Elementary School,"Elementary School, K-5",275,Willem Vroegh,8:40 am-2:40 pm,Roosevelt Middle School,Inner Richmond,NA,"Breakfast, Lunch, After School Supper",569,We realize everyone has a busy schedule and with little kids things always seem to come up. For these reasons reservations are not required. Please be aware that some tours will be very crowded and some will not be. We do not visit classrooms during instruction.,Our fee based before school program is open from 7:35-8:20 daily. It is run by the Richmond Neighborhood Center.,2:40-6:00 on site daily run by the Richmond Neighborhood Center. We have a bus to the JCC and to the  Booker T Community Center.   Fee based(scholarships available) PTA after school enrichment classes are offered daily from 2:40-3:50.,We have two SDC classes in 19/20; a k-3 and 3-5 MM,Tutoring in school,"We have an articulated arts program (music, dance, visual and performing arts). We work with SFUSD VAPA teachers and hired consultants for semester to year long instruction in the above disciplines.  We have a partnership with the SF Opera and have opera programs and residencies for grades k-3. Dance in the Schools through the SF Ballet for grades 2&3.",NA,"251 6th Avenue, San Francisco, CA, 94118",415-750-8480,415-750-8487,http://www.peabodyschool.com/,NA,We realize everyone has a busy schedule and with little kids things always seem to come up. For these reasons reservations are not required. Please be aware that some tours will be very crowded and some will not be. We do not visit classrooms during instruction.,NA,NA,NA,NA,NA,NA
George R. Moscone Elementary School,"Early Education, Elementary School, PreK-5",405,Valerie Ann Hoshino,7:50 am-1:50 pm,NA,Mission,94110,"Breakfast, Lunch",723,"Our faculty is committed to engaging and motivating students to become joyous, lifelong learners . Children have daily opportunities to participate in instruction through music, movement, and project based learning. Teachers collaborate closely and continually to share ideas and provide the best opportunities to promote student success, both academically and socially. We believe in strong communication and teamwork with families to support student achievement. Translation is an integral part of information and dialogue with families as all information (weekly newsletters, morning announcements, etc) are conveyed in three languages: English, Chinese, and Spanish.",Breakfast served from 7:25 to 7:45 a.m.,Mission Recreation Center one block away. Call 415-695-5012 for details.,Resource Specialist services,Technology teacher,"Dance program. art program. PE coach, Instrumental Music",Therapist,"2576 Harrison Street, San Francisco, CA, 94110",415-695-5736,415-695-5341,NA,NA,Wednesday morning at 8:15 after Fall Enrollment Fair. Arrangements can be made with visitors who are unable to make the Wednesday tour.,Spanish Dual Language Learner Pre-Kindergarten,sch723@sfusd.edu,NA,"White collared shirt or blouse, navy blue pants, skirt, or jumper.",NA,NA
Glen Park Elementary School,"Elementary School, K-5",385,Liz Zarr,8:40 am-2:40 pm,James Lick Middle School,Glen Park,NA,"Breakfast, Lunch, After School Supper",575,"We hold high expectations for all staff, students, and families, and support this in a variety of ways: we nurture a rigorous professional learning community, provide parent education and participation opportunities, and differentiate curriculum for student access. We use a restorative approach to problem solving and conflict resolution between and among students, staff, and families. We also have regular showcases of academic and artistic work to allow students to experience the satisfaction of a job well done. In addition, we provide literacy support in English and Spanish, a full-time librarian, and a Wellness Center staffed by a full-time social worker. Our teachers provide a solid foundation of skills instruction integrated with thematic teaching across grade levels, we use the Teachers College Reading and Writing Workshop model, and staff meets regularly to analyze programs and practices to ensure student academic, social, and emotional needs are being met.",NA,Day staff and afterschool staff coordinate efforts through a teacher liaison to support student academic achievement and social/emotional growth.,Separate class - Moderate/severe with autism focus,Spanish literacy interventionist,NA,Therapist,"151 Lippard Avenue, San Francisco, CA, 94131",415-469-4713,415-337-6942,http://www.glenparkschool.org/,NA,Tuesdays 9 - 10 am,Spanish Biliteracy Program,sch575@sfusd.edu,NA,NA,NA,NA
Gordon J. Lau Elementary School 劉貴明小學,"Early Education, Elementary School, PreK-5",710,Gloria Choy,8:40 am-2:40 pm,Marina Middle School,Chinatown,NA,"Breakfast, Lunch, After School Supper",490,"Even though our school is the largest elementary school in the district, we try to meet the needs of every student.",Our morning literacy program is a free service for working parents who need to drop off as early as 7:50 a.m.,"On-site after-school program: 2:40 to 6:00 p.m., grades K-5. Includes activities such as tutoring, arts, or field trips.",Resource Specialist services,Tutoring in school,"AIM program, SF Symphony, Acrosports, SFartsED, Purple Silk",Therapist,"950 Clay Street, San Francisco, CA, 94108",415-291-7921,415-291-7952,http://laues.sfusd.edu/,Lisa Kwong,9:00 a.m. Tuesdays (October to April). Please call our school office at (415)291-7921 to set an appointment.,Cantonese Biliteracy Program,sch490@sfusd.edu,NA,NA,NA,NA
Grattan Elementary School,"Early Education, Elementary School, PreK-5",410,Catherine Walter,7:50 am-1:50 pm,A.P. Giannini Middle School,Haight Ashbury,NA,"Breakfast, Lunch",589,"At Grattan, we take a unique approach to teaching. We believe that authentic learning will take place with the acquisition of real skills in real context, and that children will engage more freely and learn best if given choice whenever possible—while being allowed to create and tinker frequently. We believe that gym and art are paramount to education as is the need to use the outdoors as a learning environment. We believe that good books across all genres are absolutely necessary to instill a love of reading. We are committed to exploring alternative forms of assessment including progress report narratives, portfolios of authentic work, oral exams, student presentations, and performances. All students participate in daily classroom activities that are integrated and designed to be open-ended and highly engaging.",NA,"Grattan After School Program (GASP) is a sliding-scale, tuition-based K-5 program with direct connections to the school day. SFUSD Early Education Department Out of School Time Program: PreK only, 7:45 a.m.-5:45 p.m., 415-759-2850.",Separate class - Moderate/severe with autism focus for grades K-5,Tutoring in school,"Technology, Storytelling",Social worker,"165 Grattan Street, San Francisco, CA, 94117",415-759-2815,415-759-2803,NA,NA,NA,NA,Sch589@sfusd.edu,NA,NA,NA,NA
Guadalupe Elementary School,"Early Education, Elementary School, PreK-5",420,Maria Luz Agudelo,8:40 am-2:40 pm,Visitacion Valley Middle School,Excelsior,NA,"Breakfast, Lunch",593,"We promote equity by providing learning experiences and interventions that will prepare our students to succeed in secondary and post-secondary school and compete in an increasingly complex global society. We provide a rigorous, non-competitive setting where all students feel included and are encouraged to take risks and work towards their personal best. Teachers will use various strategies and teaching methodologies to make concepts accessible to all learners. Schoolwide implementation of the Visual Thinking Strategies protocol improves students' observation, thinking, and discussion skills. These strategies will also strengthen the writing of English Learners. Instruction will be differentiated to meet the individual needs of English Learner students.",NA,"SFUSD Early Education Department Out-of-School-Time Program: Excelsior @ Guadalupe, PreK & K-5 grade, 2:30 p.m.-5:30 p.m., 7:30 a.m.-5:30 p.m. (spring break & summer), 415-469-4753.",Resource Specialist services,Technology teacher,"Ceramics, Music",Mentoring,"859 Prague Street, San Francisco, CA, 94112",415-469-4718,415-469-4066,NA,Thomas Graven,Wednesdays from Oct. to Jan. Call school for times and dates.,Spanish Biliteracy Program,sch593@sfusd.edu,NA,NA,NA,NA
Harvey Milk Civil Rights Academic Elementary School,"Elementary School, K-5",245,Ronnie Machado,9:30 am-3:35 pm,Everett Middle School,Castro/Upper Market,"94110, 94124, 94134","Breakfast, Lunch, After School Supper",505,"Harvey Milk Civil Rights Academy is a small school in the Castro, named after its most famous persona—Harvey Milk! Our mission is to empower student learning by: teaching tolerance and non-violence; celebrating our diversity; achieving academic excellence; building strong home-school community connections; and understanding lessons from the Civil Rights Movement centered on social justice and peace. We are a Model Inclusive School, meaning our students with identified special needs are included and supported within the general education classroom. We support our experienced, high-quality teachers with resources and weekly time to collaborate.","We partner with the Mission YMCA to provide services to our before and after school programs. Their mission is ""to build strong kids, strong families and strong communities by enriching the lives of all people in spirit, mind and body...building the skills and habits for a healthy life, being empowered to reach their highest potential.""","ExCEL program, Monday through Friday, end of school until 5:00 or 6:00 PM. Free of cost.",Resource Specialist services,Technology teacher,Writing or poetry,Therapist,"4235 19th Street, San Francisco, CA, 94114",415-241-6276,415-241-6545,https://harveymilk.com/,NA,Please call or check our website.,NA,sch505@sfusd.edu,NA,NA,NA,NA
Hillcrest Elementary School,"Elementary School, K-5",450,Katerina Palomares,School yard supervision starts only at 7:30am.,"Dr. Martin Luther King, Jr. Middle School",Excelsior,"94124, 94134","Breakfast, Lunch, After School Supper",614,"At Hillcrest, every classroom features learning activities that are rigorous, relevant, and relational. In practical terms, it is our hope that students are given meaningful learning activities that are connected to their experiences, interests, inclinations, culture and collaborative spirit. Students are to engage in learning that develops their academic, intellectual and social growth.",NA,Assistance in finding off-site programs,Separate class - Mild/moderate,Mission Science Workshop program,Visual arts,Family liaison,"810 Silver Avenue, San Francisco, CA, 94134",415-469-4722,415-469-4067,NA,Beth Bonfiglio,"Wednesday mornings at 9 a.m., hosted by family liaisons. Please call to schedule. Spanish and Cantonese interpretation available.",Spanish Biliteracy Program,NA,NA,Optional - any white-collared shirt and navy blue bottom.,NA,NA
Jean Parker Elementary School,"Elementary School, K-5",235,Sara Saldaña,8:40 am-2:40 pm,Francisco Middle School,"Chinatown, North Beach, Russian Hill",NA,"Breakfast, Lunch, After School Supper",638,Come see what we're all about!,NA,"Program: K-5th grade, 2:30PM-6:00PM, 8:00AM-6:00PM (Spring Break & Summer), (415) 291-7967.",Resource Specialist services,Tutoring in school,"Artist-in-residence, visual art, instrumental music, Adventures in Music",Family liaison,"840 Broadway Street, San Francisco, CA, 94133",415-291-7990,415-291-7996,https://sites.google.com/sfusd.edu/jeanparkerelementary/home,NA,Every Thursday 10/24/19 - 12/19/19 from 8:45 am - 9:45 am. Contact school to sign up or to arrange an alternate visit.,Cantonese Biliteracy Program,sch638@sfusd.edu,NA,"White Shirt, Navy pants (Optional: Plaid Jumper, Royal Blue Sweater)",NA,NA
