school_name,school_type,estimated_enrollment,principal,hours,this_school_feeds_into,neighborhood,school_bus,school_meals,school_code,about,before_school_programs,after_school_programs,special_education_programs,school_day_academic_enrichment,arts_enrichment,student_support_programs,address,phone_number,fax_number,website,assistant_principal,school_tour,language_programs,email,other_campuses,uniforms_policy,athletics,transportation
Jefferson Elementary School,"Elementary School, K-5",515,Dr. Kim Gilmore,8:40 am-2:40 pm,A.P. Giannini Middle School,Inner Sunset,94102,"Breakfast, Lunch",644,"Jefferson Elementary is a large school with a small school feel. Jefferson's unique location allows for dynamic partnerships with the greater community and the enhancement of educational opportunities for both students and teachers. The teachers and staff at Jefferson are curious learners who are passionate about delivering meaningful and authentic learning. Students come to Jefferson with a range of talents and interests that are enhanced by the numerous educational programs and Jefferson traditions. The Arts and Sciences are key strengths that directly impact student success, as well as peer mentoring and buddy programs. With a diverse student population, Jefferson takes a holistic approach and continuously focuses on differentiating instruction that meets the needs of each student. Students leave Jefferson as well-rounded citizens with skills to visualize and create a future of success for themselves and their community.",7:45 to 8:40 a.m.,"SFUSD Early Education Department Out of School Time Program: K-5th grade, 2:40PM-5:45PM, 7:45AM-5:45PM (Spring Break & Summer), (415) 759-2795. Various enrichment activities.",Separate class - Mild/moderate with autism focus,Project-based learning,"Drama, visual arts, ceramics, dance, poetry, Adventures in Music program, San Francisco Opera School Partnership program.",Social worker,"1725 Irving Street, San Francisco, CA, 94122",415-759-2821,415-759-2806,NA,NA,Most Fridays 9 a.m. Oct. to Dec 13th,NA,sch644@sfusd.edu,NA,NA,NA,NA
John Muir Elementary School,"Early Education, Elementary School, PreK-5",255,Sara Liebert,8:40 am-2:55 pm,James Lick Middle School,Lower Haight/Western Addition,"94124, 94110, 94115, 94130, 94102","Breakfast, Lunch, After School Supper",650,We consider families to be the first teachers of their children and our motto at John Muir is: “teamwork makes the dream work.”,Before-school care is provided for a nominal fee by the Beacon Program.  Call 415-749-2714 for more information.,Onsite afterschool care for K-5 students offered through Beacon Community YMCA at no cost. Call 415-749-2714 for more information.,Resource Specialist services,Spanish literacy interventionist,"Visiual and performing arts, Stagewrite, performing arts workshop",Therapist,"380 Webster Street, San Francisco, CA, 94117",415-241-6335,415-431-9938,https://www.johnmuirsf.com/,NA,Parent liaison hosts school tours on Wednesdays at 9:00 a.m. Please call for an appointment. Identification is required on the day of the tour.,Spanish Biliteracy Program,lieberts@sfusd.edu,NA,"White or burgundy polo shirt; navy blue pants, skirt or jumper; blue or burgundy sweater",NA,NA
John Yehall Chin Elementary School,"Elementary School, K-5",275,Allen Lee,9:25 am-3:35 pm,Francisco Middle School,North Beach,94102,"Breakfast, Lunch",872,"Monthly programs such as the School Spirit Store, and weekly programs such as the School Pride Tickets, and the Lily Cai Chinese Cultural Dance Program are just some of the unique opportunities that our students and families all love.",NA,3:35 to 6:00 p.m.: fee based based on qualifications. Run by the Chinatown YMCA here on site at JYC. Only open to select students new to JYC who now attend JYC and to pre-qualified students who attend JYC. Students receive help with homework and participate in recreational and enrichment activities.,Resource Specialist services,Project-based learning,LEAP...imagination in learning (in spring semester); San Francisco Ballet (in early spring semester); Lily Cai Chinese Cultural Dance (Tuesdays); VAPA Music; VAPA Dance,Social worker,"350 Broadway, San Francisco, CA, 94133",415-291-7946,415-291-7943,NA,NA,Call the school to schedule.,Cantonese Biliteracy Program,NA,NA,White or blue tops; blue bottoms; school t-shirt; school sweatshirt (encouraged),NA,NA
Jose Ortega Elementary School,"Early Education, Elementary School, PreK-5",415,Benjamin Klaus,7:50 am-1:50 pm,Aptos Middle School,Ocean View,NA,"Breakfast, Lunch, After School Supper",746,"Many opportunities augment the academic curriculum at Ortega. Students receive 100 minutes of physical education weekly. Our community garden and our greening projects are connected with science education. The Stonestown YMCA runs an onsite afterschool program that provides a nurturing environment for our students. Additional programs offered at Ortega include social awareness programs (penny and can drives), performance opportunities, kickball and cheerleading teams, Ocean's week, and the 5th grade camping trip.",Breakfast is served from 7:30 to 8:15 AM.,"Mon-Fri, 1:50 to 6:00 PM. Umoja After School Program K-5 provides students with a variety of fun activities, field trips, and healthy snacks under the care of professionally trained YMCA employees at the school. $230-$428/month or ExCEL program at no cost.",Resource Specialist services,STEAM (science; technology; engineering; arts; mathematics),Instrumental music (grades 4-5),Family liaison,"400 Sargent Street, San Francisco, CA, 94132",415-469-4726,415-584-7972,http://www.joseortegaschool.org/,NA,"9 a.m. on Tuesdays from October to January. An appointment is necessary; please call the office so we can arrange a parent tour guide to show you the school. Also, please let us know if a translator is required.",Mandarin Dual Language Immersion,sch746@sfusd.edu,NA,"Navy blue cardigans/sweat jackets, navy blue pants (no jeans), navy blue jumpers, navy blue, light blue or white collared shirts or blouses, and white or blue socks.",NA,NA
Junipero Serra Elementary School,"Elementary School, K-5",320,Eve Cheung,8:30 am-2:45 pm,NA,Bernal Heights,NA,"Breakfast, Lunch",656,"A strong caring school community works together towards the academic success of all students. This is realized through our Caring Schools Community meetings where students have a voice in problem-solving, social issues, or issues important to them. Parents and students communicate through home-side activities, and buddies create a sense of school community. Our teachers collaborate with each other and offer extra help to provide the best education for our students.",NA,"Program: K-5th grade, 2:30PM-5:30PM, 7:30AM-5:30PM (Spring Break & Summer), (415) 695-5922.",Resource Specialist services,Technology teacher,NA,NA,"625 Holly Park Circle, San Francisco, CA, 94110",415-695-5685,415-920-5194,NA,NA,Call school for times/dates.,Spanish Biliteracy Program,NA,NA,NA,NA,NA
Lafayette Elementary School,"Early Education, Elementary School, PreK-5",565,Jacob Hodgson,7:50 am-1:50 pm,Presidio Middle School,Outer Richmond,NA,"Breakfast, Lunch",664,"Teachers at Lafayette employ a multicultural curriculum that celebrates and honors the rich ethnic and cultural heritage that is representative of our student population and of the greater community in which we live. School wide programs that honor our diversity include Multicultural Night, Lunar New Year Lion Dance, and Black History Month. We value the involvement of parents and families in our school. The Parent Teacher Association sponsors school wide activities to support student learning, build community and create joy. These activities include the Reflections Art Contest,  Halloween Carnival, Spell-a-Thon, Book Fair, School Musical, Silent Auction and the End-of-Year Picnic.",NA,"YMCA after school program: fee-based, grades K-5, 1:50 to 6:00 p.m.",Separate classes with a focus on services for deafness and hearing impairment: PreK to 5 (auditory/oral),Technology teacher,Lafayette has a strong visual and performing arts focus.,Therapist,"4545 Anza Street, San Francisco, CA, 94121",415-750-8483,415-750-8472,PTA WebsiteRDNC Afterschool Program,Craig Berger,"Hosted by the principal from October through January, Wednesdays from 8:30 to 10:00 AM. By appointment only . Please call to schedule escorted visits. Your picture ID will be kept during time of visit, and sign-in and badges are required.",NA,sch664@sfusd.edu,NA,NA,NA,NA
Lakeshore Alternative Elementary School,"Elementary School, K-5",530,Matthew Hartford,9:30 am-3:35 pm,James Denman Middle School,Lakeshore,NA,"Breakfast, Lunch, After School Supper",670,"Lakeshore families come from far and wide with a range of experience in schools, speaking many languages and needing a range of social and academic supports. We employ a full time School Social Worker and Elementary Adviser to meet social and behavioral needs of our students. In 2019-20 we will employ a full time teacher as a literacy specialist to serve the academic needs of all students.",Mandarin and Cantonese language before- and after-school programs: 8:15 to 9:15 a.m. and 3:45 to 4:45 p.m.,Japanese Asobi: Tuesdays 3:45 to 4:45 PM,Separate class - Mild/moderate with autism focus,STEAM (science; technology; engineering; arts; mathematics),"Studio art, music (grades K-2), SF Ballet (grade 2), SFUSD Elementary Arts Program",Mentoring,"220 Middlefield Drive, San Francisco, CA, 94132",415-759-2825,415-753-8312,http://www.lakeshoreelementary.org/,Sarah Twiest,Please check lakeshoreelementary.org for latest available dates,NA,sch670@sfusd.edu,NA,NA,NA,NA
Lawton Alternative School (K8),"Elementary School, K-8 School, Middle School, K-8",615,Armen Sedrakian,Middle School: 9:00 a.m. - 3:16 p.m.,NA,Outer Sunset,"94112, 94122, 94124, 94134","Breakfast, Lunch",676,"Our teachers design lesson plans that maximize the opportunities for our students to become actively involved in mastering the specific subject matter. Our dedicated teachers also maintain regular communication with students' parents and involve parents in their children's education. Teachers provide progress reports to parents in addition to regular report cards. Information to parents focuses on assessments, achievement data, meeting standards, and completion of requirements for grade level and promotion. Teachers at Lawton create classrooms that are responsive to all diverse learners. They engage students in discussion, debate, creative thinking, questioning, and teamwork, and promote relationship building and interdependence.",K.E.E.P - Fee-based AM and PM childcare. Call 415-681-0390 or 415-661-9891 for more details.,*Fee based Mandarin program,Separate class - Moderate/severe,Technology teacher,"Artists-in-residency for dance and theatre, literary, and fine arts; music teacher for performing arts; and partnership with the San Francisco Ballet and the San Francisco Symphony-Adventures In Music Program.",Counselor,"1570 31st Avenue, San Francisco, CA, 94122",415-759-2832,415-759-2842,NA,Heidi Dobrott,"Middle school tours will be held on 4 Wednesdays from 10-11am. Dates are: 10/23, 10/30, 11/6, 11/13. Eventbrite link: https://www.eventbrite.com/e/lawton-alternative-middle-school-tour-2019-tickets-49975645501Lawton Alternative Middle School Tour 2019",NA,sch676@sfusd.edu,NA,NA,NA,NA
Leonard R. Flynn Elementary School,"Early Education, Elementary School, TK-5",465,Tyler Woods,8:35 am-2:45 pm,James Lick Middle School,"Bernal Heights, Mission",NA,"Breakfast, Lunch, After School Supper",680,"Community: We celebrate diversity and encourage acceptance for all people by modeling empathy, respect and non-violence.",NA,"Mission Graduates: 2:40 to 5:30 PMSFUSD Out of School Time Program: 2:30PM-6:00 PM, (Spring/Summer Break - Full Days), (415) 695-5782Mariposa Kids: 2:40 to 6:00 PM, (415) 323-0732",Separate class - Social-emotional/behavioral enhanced classroom (SOAR),Tutoring in school,Visual arts,Therapist,"3125 Cesar Chavez Street, San Francisco, CA, 94110",415-695-5770,415-695-5837,NA,Janice Jones Mitchell,01/15/2020,Spanish Dual Language Immersion,NA,NA,"Top: white or dark green, plain with no logo (Flynn gear ok).  Bottom: black or khaki pants or shorts; black, khaki, or “Carden plaid” skirt.",NA,NA
Longfellow Elementary School,"Elementary School, K-5",520,Alicia Aleman,Jamestown provides before school care from 7:00-8:20 for a fee,James Denman Middle School,Outer Mission,NA,"Breakfast, Lunch, After School Supper",691,"Our goal is to nurture confident, open-minded, independent thinkers. We prepare students for global responsibility and educate them for human greatness.",Breakfast at 8:20 AM,Boys and Girls Club (Excelsior) 415-334-2582,Separate class - Mild/moderate for grades 1-5,Technology teacher,Visual arts,Social worker,"755 Morse Street, San Francisco, CA, 94112",415-469-4730,415-469-4068,SF Longfellow PTA,Hector Lee,Mondays 9:15 am. Call school for times/dates.,Filipino Foreign Language in Elementary School (FLES) Pathway is for all students are eligible regardless of language proficiency.,alemana@sfusd.edu,NA,"White shirts, navy blue pants or skirts, navy blue cardigan sweater.",NA,Muni 14
Malcolm X Academy Elementary School,"Early Education, Elementary School, PreK/TK-5",115,Matthew Fitzsimmon,8:20 am-2:40 pm,"Willie L. Brown Jr. Middle SchoolDr. Martin Luther King, Jr. Middle School",Bayview,94124,"Breakfast, Lunch, After School Supper",830,"Our academic program focuses on increasing our student achievement with an emphasis on inspiring a passion for learning.We provide students with a high-quality education that prepares them to fully participate as citizens in the 21st century. As a community school, we collaborate with students and families. We promise to hear and include our students' and families' voices, dreams, and hopes in planning and developing our school culture and academic program.",Black to the Future / Urban Ed Academy. Schoolyard is open at 8:00 a.m.,Hours are MTuWF from 2:40 to 6:00 p.m. and Th from 1:00 to 6 p.m.,Resource Specialist services,Tutoring in school,Writing or poetry,Therapist,"350 Harbor Road, San Francisco, CA, 94124",415-695-5950,415-647-1647,NA,NA,Call 415-695-5950 to schedule an appointment.,NA,sch830@sfusd.edu,NA,"Black, Navy Blue or Brown Pants, Shirts White, Navy Blue or Black Polo",NA,NA
Marshall Elementary School,"Elementary School, K-5",265,Peter Avila,"Supervision on yard begins at 8:20 AM. Breakfast Club starts at 7:30. If interested in signing up for Breakfast Club, please see Parent Resources Page for more information.",Everett Middle School,Mission,NA,"Breakfast, Lunch",714,"Students at Marshall Elementary School are high-achieving, joyful learners—and we actively engage them in the learning process. At Marshall, we believe in allocating resources according to individual needs. We aim to ensure that all community voices are heard, to hold students to high expectations, and to showcase and celebrate student work. We welcome and value parent, teacher, and community input to make collaborative decisions to increase student achievement and promote joyful learning. Our vibrant and growing Parent Teacher Association provides financial funding to support many academic programs.",Morning Homework Club from 7:30-8:15 a.m.,"Mission Graduates, no cost for students who qualify for Free/Reduced Lunch. Implementing for 2015-2016 sliding scale fee for families who do not meet free/reduced lunch criteria. Gr. 1-5: 2:55-6pm (M-Th), 2:55-5pm (F), K: 2:55-5pm. CYO offsite bus pick up at school-fee based. Mission Boys and Girls Club pick up at site, walk students to program.",Resource Specialist services,Outdoor education program,"Visual Art for all grades. Music for grades 3-5. Berkeley Rep Theatre in grades K-2, LEAP ARTS in grades 3-5.",Family liaison,"1575 15th Street, San Francisco, CA, 94103",415-241-6280,415-241-6547,https://sites.google.com/sfusd.edu/escuelamarshall/home,NA,Fridays  8:40AM-10:00 October-January. Please call the school to schedule appointment.,Spanish Dual Language Immersion,NA,NA,"White Shirts, Navy Blue pants, skirts, or jumpers with Navy Blue Sweaters.",NA,NA
McKinley Elementary School,"Elementary School, K-5",380,Molly Pope,7:50 am-2:00 pm,Everett Middle School,Castro/Upper Market,NA,"Breakfast, Lunch",718,"Besides our strong core curriculum, we offer enrichment programs such as Adventures in Music, Artist in Residence, and Music as well as many special events during the year. In addition, the Afterschool Enrichment Program runs a high quality, licensed, on-site program. The afterschool program staff work with teachers to support and enrich curriculum from the regular school day. We believe that everyone in the school community (including staff, parents and students) is responsible for student achievement. In order to keep our promises to the families at McKinley, we must make sure that communication is frequent and reaches all families in a timely manner. We welcome every family to feel included in school meetings, events, and activities.",NA,"After School Enrichment Programs (ASEP), Monday through Friday, 2:00 to 6:00 p.m. (Wednesdays 1:00-6:00)",Resource Specialist services,Tutoring in school,Visual arts,Social worker,"1025 14th Street, San Francisco, CA, 94114",415-241-6300,415-241-6548,http://mckinleyschool.org,NA,Visit our tours page for up-to-date tour information and to book a tour.,NA,NA,NA,NA,NA,NA
Miraloma Elementary School,"Elementary School, K-5",415,Noah Ingber,7:50 am-1:50 pm,James Denman Middle School,Miraloma,NA,"Breakfast, Lunch",722,"Vision: Our goal is for all students at Miraloma to enjoy learning and achieve their personal best. We aim to guide all students to become resourceful and resilient lifelong learners who persevere when presented with academic, social and emotional challenges. We strive to teach students to be active participants in their community and advocates for social justice. We wish for students to leave Miraloma with a solid foundation for success, knowing that they have the tools needed to navigate the changing world.",NA,Visit http://www.miralomaschool.com/main/after-school-programs.html for more information.,Separate class - Mild/moderate with autism focus,STEAM (science; technology; engineering; arts; mathematics),Writing or poetry,Social worker,"175 Omar Way, San Francisco, CA, 94127",415-469-4734,415-469-4069,https://miralomasf.com/,NA,Schedule a tour or take an online tour by watching our video podcasts. Go to Miralomasf.com for most up to date tour information.,NA,sch722@sfusd.edu,NA,SFUSD dress code,NA,NA
Mission Education Center Elementary School,"Elementary School, PreK-5",82,Carla Llewelyn-Vasquez,9:30 am-3:30 pm,James Lick Middle School,Noe Valley,94131,"Breakfast, Lunch",724,Learn more about our prekindergarten.,NA,NA,Resource Specialist services,Spanish literacy interventionist,"SF Ballet World Dance Program, Visual/Creative Arts, Performing Arts Workshop, Symphony Program, Music Program, Peopleologie Arts Program",Therapist,"1670 Noe Street, San Francisco, CA, 94131",415-695-5313,415-695-5339,NA,NA,Call to schedule an appointment.,Spanish Newcomer Program,sch724@sfusd.edu,NA,NA,NA,NA
Monroe Elementary School,"Elementary School, K-5",546,Thor Boucher,8:25 am-2:50 pm,NA,Excelsior,NA,"Breakfast, Lunch, After School Supper",729,"At Monroe, teachers know their students and base their lessons on students' strengths, needs and interests. They don't just know students' names, but their learning preferences, the knowledge they bring to each task and their families' backgrounds and cultures. We believe that our job is to ensure that all students develop high academic vocabulary and standards based skills, are able to navigate complex social situations and embrace the diversity of their community. We believe that educational success is the collective responsibility of students, teachers, school staff, and families. Monroe students are the students of all staff, not just their classroom teacher. We keep our promises to our community through the variety of committees and cross-cultural opportunities that are open to families, including movie nights and a Fall Fun Festival.",Breakfast at 7:45 a.m. in the cafeteria and yard supervision from 8:10 a.m.,"SFUSD Early Education Department Out of School Time Program: Excelsior @ Monroe, K-5 grade, 2:30-5:30 p.m., 7:30 a.m.-5:30 p.m. (Spring Break & Summer). Call 415-469-4771 to learn more.",Resource Specialist services,Computer lab,Chinese Drumming,NA,"260 Madrid Street, San Francisco, CA, 94112",415-469-4736,415-469-4070,http://monroeelementaryschool.org/,NA,Please go to monroeelementaryschool.org to find tour dates and sign up.,Spanish Dual Language Immersion,NA,NA,"Monroe does not require school uniforms, however, we do follow SFUSD's Dress Code policy.",NA,NA
New Traditions Creative Arts Elementary School,"Elementary School, K-5",265,Julie Alderete,9:30 am-3:30 pm,Roosevelt Middle School,Haight Ashbury,NA,"Breakfast, Lunch, After School Supper",735,Music Teacher,YMCA provides care for students starting at 7:30am.,"YMCA: 3:30 to 6:15 p.m.  Also PTA-sponsored activities such as Spanish, chess, ceramics, yoga, and drama.",Resource Specialist services,Tutoring in school,Music,Mentoring,"2049 Grove Street, San Francisco, CA, 94117",415-750-8490,415-750-8479,http://www.newtraditionssf.com/,NA,Please check back for more information on Oct. 20.,NA,sch735@sfusd.edu,NA,NA,NA,NA
Paul Revere (PreK-8) School,"Early Education, Elementary School, K-8 School, PreK-8",499,William Eaton,Early release on Thursdays at 1:00 p.m.,NA,Bernal Heights,"94107, 94124","Breakfast, Lunch, After School Supper",760,About Paul Revere,SFUSD breakfast 7:25-7:45am.,"1:50-6pm - SF Rec & Parks after school at St. Mary's Rec Center, grades 6-8",Separate class - Mild/moderate for grades K-5,Technology teacher,VAPA visual arts grades K-5; instrumental music 4-5; Young Audiences of Northern California provide artists residencies throughout the school year in K-5; Performing Arts Workshop runs a middle school arts elective and after-school programming. San Francisco Shakespeare Festival provides a middle school drama elective and summer camp. San Francisco Symphony Adventures in Music provides field trips and on-site concerts grades 1-5. VAPA provides funding for a singing and performance teacher for an elective in grades 7-8.,Therapist,"555 Tompkins Avenue, San Francisco, CA, 94110",415-695-5656,415-647-0878,NA,Sherifa TiamiyuOluwabunmi Hart,"School tours are weekly at 8:30 a.m. Mondays. To schedule a visit, call 415-695-5656.",Spanish Dual Language Immersion,NA,NA,Black pants or skirt/white collared shirt,NA,NA
Redding Elementary School,"Early Education, Elementary School, TK-5",265,Jeanne Dowd,8:40 am-2:40 pm,Marina Middle School,Nob Hill,94130,"Breakfast, Lunch, After School Supper",790,"At Redding, we believe that joyful learning means teachers providing stimulating and varied experiences for all students, regardless of performance level. We celebrate the achievement of all of our students, and diligently monitor student attendance through our Student Attendance Review Team. We maintain ongoing communication with families (through interpreters as necessary.) Staff value knowing every student's current achievement level and suggest strategies and/or interventions to advance each student to the next level. We expect our students to be successful in their educational journey here so that they can be responsible, respectful citizens who positively contribute to our society. We are a community of life-long, joyful learners!","We also have a before-school program, called The Amazing Morning Program, for a limited number of students starting at 7:15.",Our early education after school program offers year-round childcare and education.,Resource Specialist services,Tutoring in school,Students receive a variety of arts enrichment with professional artists-in residence programs such a choral music and dance. Through SFUSD's visual and performing arts program students experience visual and performing arts on a weekly basis. Redding School also has a strong partnership with SF Ballet & SF Symphony.,Therapist,"1421 Pine Street, San Francisco, CA, 94109",415-749-3525,415-749-3527,https://reddingschool.com/,NA,"Tuesdays 9:00-10:00 10/2-12/11; except 10/30, 11/20 & 12/18",Arabic Foreign Language in Elementary School (FLES) Program,790sch@sfusd.edu,NA,NA,NA,NA
